Epicerie sucrée;Cafe;AUCHAN Capsule de café espresso intensité 7 compatibles Dolce Gusto;3,68;3,34;3,34;3,34;3,41;3,47;3,34;3,34;3,47;3,41;3,47;3,51;3,47;3,34;
Epicerie sucrée;Cafe;AUCHAN Capsule de café espresso intenso numéro 9;;3,34;3,34;3,34;3,41;3,47;3,34;3,34;3,47;3,41;3,47;3,51;3,47;3,34;
Epicerie sucrée;Cafe;AUCHAN Capsules de café 100% Brazil;;;;;2,55;;;2,50;;;;2,46;2,34;;
Epicerie sucrée;Cafe;AUCHAN Capsules de café Espresso classico intensité 8 compatibles Nespresso;2,53;2,30;2,30;2,30;2,35;2,39;2,30;2,30;2,39;2,35;2,39;2,42;2,39;2,30;
Epicerie sucrée;Cafe;AUCHAN Capsules de café Espresso décaféiné intensité 6 compatibles Nespresso;2,53;2,30;2,30;2,30;2,35;;2,30;2,30;2,39;2,35;2,39;2,42;2,39;2,30;
Epicerie sucrée;Cafe;AUCHAN Capsules de café Espresso intensité 10 compatibles Nespresso;2,53;2,30;2,30;2,30;2,35;2,39;2,30;1,70;2,39;2,35;2,39;2,42;2,39;2,30;
Epicerie sucrée;Cafe;AUCHAN Capsules de café Fortissimo intensité 12 compatibles Nespresso;;2,30;2,30;2,30;2,35;;;;2,39;;2,39;2,42;2,39;;
Epicerie sucrée;Cafe;AUCHAN Capsules de café au lait compatibles Dolce Gusto;2,05;1,99;1,99;1,99;1,99;1,99;1,99;1,99;1,99;1,99;1,99;1,99;1,99;1,99;
Epicerie sucrée;Cafe;AUCHAN Capsules de café espresso classique intensité 8 compatibles Nespresso;;;;;3,83;;;;;;;;;;
Epicerie sucrée;Cafe;AUCHAN Capsules de café expresso décaféiné compatible Dolce gusto;;;;;;;;3,34;;;;;;;
Epicerie sucrée;Cafe;AUCHAN Capsules de café lungo intense compatible Dolce gusto;;;;;;3,47;;;;;;;;;
Epicerie sucrée;Cafe;AUCHAN Capsules de café lungo intensité 5;3,68;3,34;3,34;3,34;3,41;3,47;3,34;3,34;3,47;3,41;3,47;3,51;3,47;3,34;
Epicerie sucrée;Cafe;AUCHAN Capsules de café lungo intensité 6 compatibles Nespresso;2,53;2,30;2,30;2,30;2,35;2,39;2,30;2,30;2,39;2,35;2,39;2,42;2,39;2,30;
Epicerie sucrée;Cafe;AUCHAN Capsules de café lungo intensité 8 compatibles Nespresso;;2,30;2,30;2,30;2,35;;;;;;2,39;2,42;2,39;2,30;
Epicerie sucrée;Cafe;AUCHAN Capsules de café noisette intensité 7 compatibles Nespresso;;2,50;2,50;2,50;2,55;;;;;;2,60;2,63;2,60;;
Epicerie sucrée;Cafe;AUCHAN Capsules de café petit déjeuner compatible Dolce gusto;;;;;;;;;;;;;3,21;;
Epicerie sucrée;Cafe;AUCHAN Capsules de café ristretto compatible Dolce gusto;;;;;;3,47;;3,34;;;;;;;
Epicerie sucrée;Cafe;AUCHAN Capsules de café ristretto n°11 compatibles Nespresso;;;;;2,35;;;2,30;;;;2,26;2,15;;
Epicerie sucrée;Cafe;AUCHAN Capsules de café vanille intensité 7 compatibles Nespresso;;2,50;2,50;2,50;2,55;;;;;;2,60;;2,60;;
Epicerie sucrée;Cafe;AUCHAN Chicorée café au lait;;3,65;3,65;3,65;3,72;;3,80;3,65;;;3,80;3,83;3,80;;
Epicerie sucrée;Cafe;AUCHAN Chicorée café soluble;;2,25;2,25;2,25;2,30;;;;;;2,34;2,36;2,34;;
Epicerie sucrée;Cafe;AUCHAN Dosettes de café classico décaféiné intensité 5 compatibles Senseo;3,75;3,40;3,40;3,40;3,47;3,54;3,40;3,40;3,54;3,47;3,54;3,57;3,54;3,40;
Epicerie sucrée;Cafe;AUCHAN Dosettes de café classique compatibles senseo;;4,20;4,20;4,20;3,87;4,37;4,20;4,20;4,37;4,28;4,37;;;4,20;
Epicerie sucrée;Cafe;AUCHAN Dosettes de café corsé compatibles Senseo;;;;;3,74;;;;;;;;;;
Epicerie sucrée;Cafe;AUCHAN Dosettes de café corsé intensité 7 compatibles Senseo;;4,20;4,20;4,20;4,28;4,37;4,20;4,20;4,37;4,28;4,37;4,41;;4,20;
Epicerie sucrée;Cafe;AUCHAN Dosettes de café doux intensité 3 compatibles Senseo;;3,20;3,20;3,20;3,26;;3,20;3,20;3,33;3,26;3,33;3,36;3,33;3,20;
Epicerie sucrée;Cafe;AUCHAN Dosettes de café saveur noisette intensité 5 compatibles Senseo;;1,60;1,60;1,60;1,63;;;;;;1,66;;1,66;;
Epicerie sucrée;Cafe;AUCHAN ESSENTIEL Café moulu;;;;;1,20;;;1,20;;;;;;;
Epicerie sucrée;Cafe;AUCHAN ESSENTIEL Café moulu intensité 5;;4,60;4,60;4,60;4,60;;;4,60;;;4,60;;;;
Epicerie sucrée;Cafe;AUCHAN Filtres à café n°2;;0,45;0,45;0,45;0,46;;;;;;0,47;0,47;0,47;;
Epicerie sucrée;Cafe;AUCHAN Filtres à café n°4 + 1 sachet de détartrant;1,10;1,00;1,00;1,00;1,02;1,04;1,04;1,00;1,04;1,02;1,04;1,05;1,04;1,00;
Epicerie sucrée;Cafe;AUCHAN GOURMET Café Brésil en capsule compatible Nespresso;;;;;2,23;;;;;;;;;;
Epicerie sucrée;Cafe;AUCHAN GOURMET Café moulu Colombie intensité 7;;2,67;2,67;2,67;2,72;;2,72;2,67;2,78;2,72;2,78;2,80;2,78;2,67;
Epicerie sucrée;Cafe;AUCHAN GOURMET Café moulu sensation Brésil intensité 6;2,95;2,67;2,67;2,67;2,72;2,78;2,72;2,67;2,78;2,72;2,78;2,80;2,78;2,67;
Epicerie sucrée;Cafe;AUCHAN GOURMET Café moulu sensation Ethiopie intensité 8;2,95;2,67;2,67;2,67;2,72;2,78;2,72;2,67;2,78;2,72;2,78;2,80;2,78;2,67;
Epicerie sucrée;Cafe;AUCHAN GOURMET Capsule de café % Colombie intensité 8 compatible Nespresso;;;;;;;;2,50;;;;;;;
Epicerie sucrée;Cafe;AUCHAN Grande capsules de café compatible Dolce gusto;;;;;3,41;3,47;;;;;;;;;
Epicerie sucrée;Cafe;CAFE LAUNAY Café d'Ethiopie 100% arabica moulu intensité 8;;;;;;;;;;;;;;2,89;
Epicerie sucrée;Cafe;CAFE LAUNAY Café doux et subtil en dosette universelle;;;;;;;;;;;;;;2,99;
Epicerie sucrée;Cafe;CAFE LAUNAY Café en grain italien intensité 8;;;;;;;;;;;;;;2,99;
Epicerie sucrée;Cafe;CAFE LAUNAY Café en grains Suave bio 100% arabica intensité 3;;;;;;;;;;;;;;14,19;
Epicerie sucrée;Cafe;CAFE LAUNAY Café en grains italien intensité 8;;;;;;;;;;;;;;11,56;
Epicerie sucrée;Cafe;CAFE LAUNAY Dosettes de café universelle corsé compatible Senseo;;;;;;;;;;;;;;2,93;
Epicerie sucrée;Cafe;CAFE PREMIUM Dosettes souples café doux;;2,29;2,29;2,29;2,29;;;;;;2,29;;;;
Epicerie sucrée;Cafe;CAFE ROYAL Café espresso forte en dosette Dolce Gusto;;3,31;;3,47;3,35;;;;;;;;;;
Epicerie sucrée;Cafe;CAFE ROYAL Café à l'amande en capsule compatible Nespresso;;;;;2,97;;;;;;;;;;
Epicerie sucrée;Cafe;CAFE ROYAL Capsules de café expresso compatibles Nespresso;;;;;4,68;;;;;;;4,75;3,90;;
Epicerie sucrée;Cafe;CAFE ROYAL Capsules de café lungo compatible Nespresso;;;;;9,24;;;;;9,30;;;;;
Epicerie sucrée;Cafe;CAFE ROYAL Capsules de café lungo compatibles Nespresso;;;;;4,68;;;;;;;;3,90;;
Epicerie sucrée;Cafe;CAFE ROYAL Décaféiné capsule;4,68;;;;;;;;;;;;;;
Epicerie sucrée;Cafe;CAFÉ DU CH'TI Café moulu 100% arabica;;;3,29;;;;;;;;;;;;
Epicerie sucrée;Cafe;CARTE NOIRE Café bio moulu Honduras;;;;;3,51;;;;;;;;;;
Epicerie sucrée;Cafe;CARTE NOIRE Café en grain bio sélection Honduras;8,79;8,28;8,94;8,55;8,28;8,69;8,79;8,69;8,74;8,74;8,94;9,25;9,05;8,55;
Epicerie sucrée;Cafe;CARTE NOIRE Café en grains;;3,70;3,75;3,75;3,67;;;;;;3,84;3,95;3,95;;
Epicerie sucrée;Cafe;CARTE NOIRE Café en grains pur arabica;15,09;13,62;13,84;13,84;13,21;14,06;14,06;13,84;14,06;13,99;14,22;14,94;14,68;13,84;
Epicerie sucrée;Cafe;CARTE NOIRE Café moulu bio;;7,17;7,73;7,40;7,17;;7,60;7,52;7,56;7,02;7,73;8,02;7,88;6,86;
Epicerie sucrée;Cafe;CARTE NOIRE Café moulu classic pur arabica;13,24;;;;;;;;;;;;;;
Epicerie sucrée;Cafe;CARTE NOIRE Café moulu décaféiné pur arabica;3,95;3,63;3,63;3,65;3,47;3,69;;;;3,67;3,73;;3,63;3,63;
Epicerie sucrée;Cafe;CARTE NOIRE Café moulu pur Arabica;;;;;5,88;;;;;;;;;;
Epicerie sucrée;Cafe;CARTE NOIRE Café moulu pur arabica;10,77;10,61;8,14;10,61;10,61;10,61;10,61;10,61;10,61;10,61;10,61;8,17;11,53;9,39;
Epicerie sucrée;Cafe;CARTE NOIRE Cappuccino café pur arabica bio prêt à boire;3,15;;;;;3,49;;2,85;;;;;;;
Epicerie sucrée;Cafe;CARTE NOIRE Capsules de café Espresso intensité 9 compatibles Nespresso;7,33;;;;;;;;;;;;;;
Epicerie sucrée;Cafe;CARTE NOIRE Capsules de café bio délicat et fruité compatibles Nespresso;;;;;2,81;;;;;;;;;;
Epicerie sucrée;Cafe;CARTE NOIRE Capsules de café espresso 100% arabica compatibles Dolce Gusto;;3,71;3,91;3,89;3,71;3,98;3,91;3,91;3,98;3,96;4,03;;;3,84;
Epicerie sucrée;Cafe;CARTE NOIRE Capsules de café espresso intense compatibles Nespresso;;;;;;;;;;;;;;2,50;
Epicerie sucrée;Cafe;CARTE NOIRE Capsules de café lungo 100% arabica intensité 5 compatibles Dolce Gusto;;;;;3,87;;3,91;3,91;3,98;3,96;4,03;;;3,84;
Epicerie sucrée;Cafe;CARTE NOIRE Dosettes de café Espresso intensité 8 compatibles Senseo;;5,82;6,02;5,99;6,05;;6,02;6,02;6,11;6,08;6,17;6,66;6,56;5,93;
Epicerie sucrée;Cafe;CARTE NOIRE Dosettes de café bio classique compostables compatibles Senseo;8,04;6,99;7,55;7,22;7,38;7,34;7,42;7,34;7,38;7,38;7,55;7,88;7,74;7,22;
Epicerie sucrée;Cafe;CARTE NOIRE Dosettes de café bio délicat compatibles Senseo;;;;;;;4,44;4,39;;;;;;;
Epicerie sucrée;Cafe;CARTE NOIRE Dosettes de café classique intensité 5 compatibles Senseo;6,06;5,66;5,66;5,86;5,65;5,66;5,66;5,66;5,66;5,66;5,66;6,63;6,53;5,66;
Epicerie sucrée;Cafe;CARTE NOIRE Dosettes de café classique n°5 compatibles Senseo;;8,57;9,09;8,74;;;;;;;9,03;;7,79;;
Epicerie sucrée;Cafe;CARTE NOIRE Dosettes de café corsé compatibles Senseo;6,54;5,82;6,02;5,99;5,82;6,11;6,02;6,02;6,11;6,08;6,17;6,66;6,56;5,93;
Epicerie sucrée;Cafe;CARTE NOIRE Dosettes de café décaféiné compatibles Senseo;4,98;;;;4,36;4,64;;;;4,62;;;;4,50;
Epicerie sucrée;Cafe;CARTE NOIRE Dosettes de café expresso intensité 11 compatibles Senseo;;4,36;4,57;4,55;4,59;;;;;;4,69;;4,67;;
Epicerie sucrée;Cafe;CARTE NOIRE Mochaccino prêt à boire pur arabica bio;;;;;;;2,89;2,85;2,87;;;;;;
Epicerie sucrée;Cafe;DOLCE GUSTO Café grande en dosette intensité 5;;7,27;7,57;7,53;7,27;;;;;;7,75;;;;
Epicerie sucrée;Cafe;DOLCE GUSTO Capsules de Ricoré Latte compatibles Dolce Gusto;5,12;4,51;4,67;4,64;4,51;4,75;4,67;4,67;4,75;4,72;4,80;5,01;4,91;4,59;
Epicerie sucrée;Cafe;DOLCE GUSTO Capsules de café Espresso Intenso numéro 7 compatibles Dolce Gusto;4,53;4,02;4,17;4,15;4,02;4,23;4,17;4,17;4,23;4,21;4,28;4,37;4,31;4,11;
Epicerie sucrée;Cafe;DOLCE GUSTO Capsules de café Espresso barista intensité 9 compatibles Dolce Gusto;4,53;4,02;4,17;4,15;4,02;4,23;4,17;4,17;4,23;4,21;4,28;4,37;4,31;4,11;
Epicerie sucrée;Cafe;DOLCE GUSTO Capsules de café Espresso décaféiné intensité 5 compatibles Dolce Gusto;;;;;4,51;;;4,67;;;;;;4,59;
Epicerie sucrée;Cafe;DOLCE GUSTO Capsules de café Espresso intensité 5 compatibles Dolce Gusto;7,64;6,86;7,35;7,43;7,35;7,35;7,50;7,35;7,35;7,50;7,02;7,53;7,53;7,03;
Epicerie sucrée;Cafe;DOLCE GUSTO Capsules de café Grande Intenso numéro 9 compatibles Dolce Gusto;5,00;;;;;4,75;;4,67;;;;;;4,59;
Epicerie sucrée;Cafe;DOLCE GUSTO Capsules de café Grande compatibles Dolce Gusto intensité 5;4,42;4,02;4,07;4,05;4,02;4,13;4,07;4,07;4,13;3,89;4,17;4,37;4,27;4,02;
Epicerie sucrée;Cafe;DOLCE GUSTO Capsules de café Lungo Intensité 6 compatibles Dolce Gusto;7,64;7,53;7,53;7,53;7,53;7,53;7,53;7,53;7,53;7,53;7,53;7,53;7,53;7,53;
Epicerie sucrée;Cafe;DOLCE GUSTO Capsules de café Lungo Intenso intensité 9 compatibles Dolce Gusto;5,12;4,51;4,67;4,64;4,51;4,75;4,67;4,67;4,75;4,72;4,80;5,01;4,91;4,59;
Epicerie sucrée;Cafe;DOLCE GUSTO Capsules de café Lungo bio de Colombie Sierra Nevada intensité 5 compatibles Dolce Gusto;4,34;3,75;4,07;3,88;3,75;3,95;4,00;3,95;3,97;3,97;4,07;4,31;4,21;3,88;
Epicerie sucrée;Cafe;DOLCE GUSTO Capsules de café Lungo décaféiné intensité 6 compatibles Dolce Gusto;4,42;4,02;4,07;4,05;4,02;4,13;4,07;4,07;4,13;4,11;4,17;4,37;4,27;4,02;
Epicerie sucrée;Cafe;DOLCE GUSTO Capsules de café au lait;;7,31;7,57;7,57;7,31;;;;;;7,75;;;;
Epicerie sucrée;Cafe;DOLCE GUSTO Capsules de café au lait compatibles Dolce Gusto;4,42;4,02;4,07;4,05;4,02;4,13;4,07;4,07;4,13;4,11;4,17;4,37;4,27;4,02;
Epicerie sucrée;Cafe;DOLCE GUSTO Capsules de café bio espresso du Péru Cajamarca intensité 8 compatibles Dolce Gusto;;3,52;4,07;3,88;3,75;;4,00;3,95;3,97;3,97;4,07;4,31;4,21;3,88;
Epicerie sucrée;Cafe;DOLCE GUSTO Capsules de café cappuccino compatibles Dolce Gusto;4,27;3,73;4,21;4,21;4,21;4,21;4,21;4,21;4,21;4,21;4,21;4,21;4,21;4,21;
Epicerie sucrée;Cafe;DOLCE GUSTO Capsules de café cortado espresso macchiato;;4,51;4,67;4,64;4,51;;;;;;4,80;;;;
Epicerie sucrée;Cafe;DOLCE GUSTO Capsules de café espresso intenso intensité 7;;;;;7,02;;;;;;;;;;
Epicerie sucrée;Cafe;DOLCE GUSTO Capsules de café grande morning;;4,50;4,79;4,76;4,82;4,89;4,79;4,79;4,89;4,86;4,96;;;4,69;
Epicerie sucrée;Cafe;DOLCE GUSTO Capsules de chocolat au lait Chococino compatibles Dolce Gusto;;4,51;4,67;4,64;4,51;;4,67;4,67;4,75;4,72;4,80;;4,91;4,59;
Epicerie sucrée;Cafe;FOLLIET Idéal café en grains tonique et corsé;;;;;9,49;;;;;;;;;;
Epicerie sucrée;Cafe;GRAND'MERE Café en grains familial;;;;;8,94;;;;;8,98;;;;8,90;
Epicerie sucrée;Cafe;GRAND'MERE Café moulu dégustation riche en arabica;;6,03;6,11;6,03;6,03;;;;;;6,25;;6,23;;
Epicerie sucrée;Cafe;GRAND'MERE Café moulu familial goût généreux;8,86;7,82;8,29;8,29;2,12;8,36;8,33;8,29;8,36;8,59;8,43;8,58;8,48;8,29;
Epicerie sucrée;Cafe;GRAND'MERE Dosettes de café classique compatibles Senseo;5,34;4,62;4,86;4,83;4,62;4,95;4,86;4,86;4,95;4,92;5,01;5,27;5,17;4,78;
Epicerie sucrée;Cafe;GRAND'MERE Dosettes un bon café corsé compatibles Senseo;;4,62;4,86;4,83;4,62;;;;;;5,01;5,27;5,17;;
Epicerie sucrée;Cafe;ILLY Café Espresso classique en capsule compatible Nespresso;;4,20;4,42;4,39;4,20;;;;;;4,55;4,76;4,70;;
Epicerie sucrée;Cafe;ILLY Café en grain classique;;6,36;6,51;6,51;6,09;;;;;;6,77;6,97;6,77;;
Epicerie sucrée;Cafe;ILLY Café moulu classique;;6,01;6,31;6,22;5,99;;;6,31;;;6,55;7,01;6,81;;
Epicerie sucrée;Cafe;ILLY Capsules de café intenso 100% arabica compatibles Nespresso;;4,20;4,42;4,39;4,20;;;;;;4,55;4,76;4,70;;
Epicerie sucrée;Cafe;JACQUES VABRE Café bio moulu Nectar;;;;;3,67;;;;;;;;;;
Epicerie sucrée;Cafe;JACQUES VABRE Café moulu notes de bahia Brésil;3,71;3,41;3,45;3,42;3,41;3,49;3,48;3,45;3,49;3,48;3,53;3,61;3,51;3,45;
Epicerie sucrée;Cafe;L'AMATEUR CAFE Café en grains 100% arabica;;;;;;;;8,99;10,07;10,00;10,20;;;9,88;
Epicerie sucrée;Cafe;L'AMATEUR CAFE Café moulu 100% arabica;;;;;;;;;;;2,81;;;2,72;
Epicerie sucrée;Cafe;L'AMATEUR CAFE Dosettes de café souples compatible Senseo;;;;;;;;;;;2,87;;;2,73;
Epicerie sucrée;Cafe;L'OR Absolu Café en grains grand cru;17,52;15,19;15,44;15,44;14,72;15,70;15,70;15,44;15,70;15,61;15,87;;16,46;16,08;
Epicerie sucrée;Cafe;L'OR Café en grains origine du Brésil;;8,85;8,98;8,98;8,61;9,11;9,11;8,98;9,11;9,07;9,20;9,52;9,32;8,98;
Epicerie sucrée;Cafe;L'OR Café en grains sélection équilibré et harmonieux;;14,71;14,94;14,94;14,27;;15,18;14,94;15,18;15,10;15,34;;15,80;15,58;
Epicerie sucrée;Cafe;L'OR Café moulu absolu aromatique et raffiné intensité 7;7,93;7,41;7,41;7,41;7,41;7,47;7,43;7,41;7,47;7,43;7,53;7,74;7,54;7,41;
Epicerie sucrée;Cafe;L'OR Café moulu doux;;11,38;11,99;11,99;11,51;;;;;11,56;11,13;;11,99;;
Epicerie sucrée;Cafe;L'OR Café moulu doux 100% arabica intensité 5;7,81;7,22;7,25;7,22;7,22;7,35;7,31;7,25;7,35;7,31;7,41;7,62;7,42;7,25;
Epicerie sucrée;Cafe;L'OR Café moulu intense 100% arabica intensité 7;7,24;5,95;6,71;6,65;5,95;6,80;6,77;6,71;6,80;6,77;6,86;6,92;6,82;6,71;
Epicerie sucrée;Cafe;L'OR Café soluble;;;;;3,80;;;;;;;;;;
Epicerie sucrée;Cafe;L'OR Capsules de café Colombia compatibles Nespresso;;3,02;3,17;3,15;3,19;;;3,17;;;3,26;3,35;3,31;;
Epicerie sucrée;Cafe;L'OR Capsules de café delizioso intensité 5 compatibles Nespresso;;2,95;3,03;;2,79;3,08;3,03;3,03;3,08;3,06;3,11;;3,15;2,98;
Epicerie sucrée;Cafe;L'OR Capsules de café décaféiné intensité 6 compatibles Nespresso;5,85;5,11;5,36;5,33;5,11;5,45;5,36;5,36;5,45;5,42;5,51;5,60;5,50;5,27;
Epicerie sucrée;Cafe;L'OR Capsules de café espresso bio intensité 7 compatibles Nespresso;3,86;3,40;3,69;3,52;3,40;3,58;3,62;3,58;3,60;3,60;3,69;3,82;3,72;3,52;
Epicerie sucrée;Cafe;L'OR Capsules de café espresso bio intensité 9 compatibles Nespresso;3,77;3,40;3,69;3,52;3,40;3,58;3,62;3,58;3,60;3,60;3,69;3,82;3,72;3,52;
Epicerie sucrée;Cafe;L'OR Capsules de café forza intensité 9 compatibles Nespresso;5,85;5,11;5,36;5,33;5,11;5,45;5,36;5,36;5,45;5,42;5,51;5,60;5,50;5,27;
Epicerie sucrée;Cafe;L'OR Capsules de café forza intensité 9 compatibles Nespresso maxi pack;11,57;10,08;10,58;10,52;;10,76;10,58;10,58;10,76;10,70;10,88;11,34;11,14;10,41;
Epicerie sucrée;Cafe;L'OR Capsules de café lungo elegante compatibles Nespresso;;3,03;3,18;3,16;3,03;;;;;;3,27;3,36;3,32;;
Epicerie sucrée;Cafe;L'OR Capsules de café lungo mattinata intensité 5 compatibles Nespresso;3,47;;;;3,20;;;3,18;;;;;;3,13;
Epicerie sucrée;Cafe;L'OR Capsules de café lungo profondo intensité 8 compatibles Nespresso;6,82;5,98;6,26;11,03;5,98;11,27;11,09;11,09;11,27;11,21;11,39;6,53;6,43;10,92;
Epicerie sucrée;Cafe;L'OR Capsules de café onyx compatibles Nespresso;;3,04;;;3,21;;;;;;3,28;;;;
Epicerie sucrée;Cafe;L'OR Capsules de café or rose intensité 7 compatibles Nespresso;;;;;3,03;;;3,18;;;;;;;
Epicerie sucrée;Cafe;L'OR Capsules de café ristretto intensité 11 compatibles Nespresso;11,28;10,03;5,36;10,15;10,03;10,15;10,25;10,15;10,47;10,25;5,51;11,33;11,13;10,12;
Epicerie sucrée;Cafe;L'OR Capsules de café splendente intensité 7 compatibles Nespresso;3,31;2,95;3,03;5,33;5,11;5,45;5,36;3,03;3,08;5,42;3,11;5,60;3,15;5,27;
Epicerie sucrée;Cafe;L'OR ESPRESSO Café Inde en capsule compatible Nespresso;;3,02;;;3,27;;;;;;3,26;;;;
Epicerie sucrée;Cafe;L'OR ESPRESSO Café Papouasie en capsule compatible Nespresso;;3,02;3,17;3,15;3,19;;;;;;3,26;;3,31;;
Epicerie sucrée;Cafe;L'OR ESPRESSO Café forza n°9 en capsule aluminium pour Nespresso;;2,79;3,03;;2,88;;;;;;3,11;3,21;3,15;;
Epicerie sucrée;Cafe;L'OR ESPRESSO Café forza n°9 en capsule compatible Nespresso;;;;;29,60;;;;;;;;;;
Epicerie sucrée;Cafe;L'OR ESPRESSO Café lungo profondo en capsule aluminium pour Nespresso;;;;;2,95;;;;;;3,27;;;;
Epicerie sucrée;Cafe;L'OR ESPRESSO Café ristretto en capsule compatible Nespresso;;2,95;3,03;;2,79;;;;;;3,11;;3,15;;
Epicerie sucrée;Cafe;L'OR ESPRESSO Café satinato n°6 en capsule aluminium pour Nespresso;;2,95;3,03;3,01;2,95;;;;;;3,11;3,21;3,15;;
Epicerie sucrée;Cafe;L'OR ESPRESSO Café sontuoso n°8 en capsule aluminium pour Nespresso;;2,95;3,03;3,01;2,95;;;;;;3,11;3,21;3,15;;
Epicerie sucrée;Cafe;L'OR ESPRESSO Café splendente en capsule compatible Nespresso;;;;;29,60;;;;;;;;;;
Epicerie sucrée;Cafe;L'OR ESPRESSO Capsules café compatibles Nespresso delisiozo;;10,55;11,05;10,99;11,11;11,23;11,05;11,05;11,23;11,17;11,35;;11,47;10,88;
Epicerie sucrée;Cafe;L'OR ESPRESSO Capsules de café Guatemala intensité 7 compatibles Nespresso;;3,02;;;3,19;;;3,17;;;3,26;;;;
Epicerie sucrée;Cafe;L'OR ESPRESSO Capsules de café delizioso intensité 5 compatibles Nespresso;5,85;5,11;5,36;5,33;5,11;5,45;5,36;5,36;5,45;5,42;5,51;5,60;5,50;5,27;
Epicerie sucrée;Cafe;L'OR ESPRESSO Capsules de café lungo mattinata compatibles Nespresso intensité 5;;;;;;;6,85;6,85;6,85;6,85;;;;6,85;
Epicerie sucrée;Cafe;L'OR ESPRESSO Capsules de café or absolu compatibles Nespresso intensité 9;6,82;5,98;6,26;6,23;6,29;6,36;6,26;6,26;6,36;6,33;6,43;6,53;6,43;6,16;
Epicerie sucrée;Cafe;L'OR ESPRESSO Capsules de café splendente intensité 7 compatibles Nespresso;;10,08;10,58;10,52;10,08;10,76;10,58;10,58;10,76;10,70;10,88;;11,08;10,41;
Epicerie sucrée;Cafe;L'OR ESPRESSO Capsules de café supremo intensité 10 compatibles Nespresso;5,73;5,11;5,36;5,33;5,11;5,45;5,36;5,36;5,45;5,42;5,51;5,60;5,50;5,27;
Epicerie sucrée;Cafe;L'OR Intense Café moulu intensité 7;;;;;13,47;;;13,47;;13,47;;;;;
Epicerie sucrée;Cafe;LAVAZZA Café Espresso barista en grains intensité 6;15,42;13,81;14,05;14,05;13,36;14,29;14,29;14,05;14,29;14,21;14,46;;14,91;14,05;
Epicerie sucrée;Cafe;LAVAZZA Café decisio en capsule compatible Nespresso;;;;;2,77;;;;;;;;;;
Epicerie sucrée;Cafe;LAVAZZA Café moulu il mattino intensité 10;7,17;6,41;6,58;6,35;6,29;6,68;6,65;6,58;6,68;6,65;6,72;7,08;6,98;6,48;
Epicerie sucrée;Cafe;LAVAZZA Café moulu l'espresso italiano classico intensité 5;5,49;4,95;5,58;5,53;5,50;5,66;5,63;5,58;5,66;5,63;5,71;6,08;5,98;5,58;
Epicerie sucrée;Cafe;LE TEMPS DES CERISES Café moulu 100% arabica saveur vanille;;4,06;;;4,27;;;;;;;;;;
Epicerie sucrée;Cafe;LE TEMPS DES CERISES Café saveur caramel moulu;;4,06;;;4,27;;;;;;;;;;
Epicerie sucrée;Cafe;LE TEMPS DES CERISES Café à la noisette pur Arabica;;4,06;4,24;4,19;4,27;;;4,24;4,32;4,29;4,38;4,54;4,44;4,24;
Epicerie sucrée;Cafe;LE TEMPS DES CERISES Dosettes de café goût noisette compatible Senseo;;;;;;;;;;;3,05;;;2,89;
Epicerie sucrée;Cafe;LE TORREF ACTEUR Café moulu bio Pérou pur arabica;;;;;;;4,24;;;;;;;;
Epicerie sucrée;Cafe;LEGAL Café noir moulu intense velouté;;;;;;;;;;6,83;;;;6,83;
Epicerie sucrée;Cafe;LEROUX Café bio à la chicorée soluble;;2,85;3,13;2,96;3,04;;;;;;3,13;;3,18;;
Epicerie sucrée;Cafe;LEROUX Chicorée en grain;;1,73;1,71;1,69;1,66;;;;;;1,76;1,75;1,75;;
Epicerie sucrée;Cafe;LEROUX Chicorée liquide nature;3,02;;;2,83;;;;;;;;;;2,88;
Epicerie sucrée;Cafe;LEROUX Chicorée soluble;3,01;2,80;2,77;2,74;2,66;;;;;;2,84;2,97;2,91;;
Epicerie sucrée;Cafe;MALONGO Café en grain des petits producteurs;7,31;6,58;6,69;6,69;6,73;6,80;6,80;6,69;6,80;6,76;6,88;7,19;7,05;6,69;
Epicerie sucrée;Cafe;MALONGO Café en grain style Italien;;6,38;6,49;6,49;6,53;;;6,49;;6,56;6,67;6,99;6,85;6,49;
Epicerie sucrée;Cafe;MALONGO Café moulu Arabica suprème;;3,71;3,85;3,81;3,87;;;;;;3,96;;3,99;;
Epicerie sucrée;Cafe;MALONGO Café moulu des goût italien pur arabica;;;;;3,27;;;3,25;;;;;;3,25;
Epicerie sucrée;Cafe;MALONGO Café moulu des petits producteurs l'original;3,21;2,92;2,95;2,92;2,92;2,99;2,98;2,95;2,99;2,98;3,03;3,15;3,09;2,95;
Epicerie sucrée;Cafe;MALONGO Café moulu la tierra pur arabica bio;4,07;3,71;3,85;3,71;3,77;3,75;3,79;3,75;3,77;3,77;3,85;4,09;3,99;3,71;
Epicerie sucrée;Cafe;MALONGO Café moulu équitable pur arabica;;5,82;5,85;5,82;5,88;5,94;6,60;5,85;5,94;5,91;6,00;6,15;6,05;;
Epicerie sucrée;Cafe;MALONGO Dosettes de café pur Arabica des petits producteurs;;3,67;3,85;3,83;3,87;3,91;3,85;3,85;;;3,96;4,19;4,09;;
Epicerie sucrée;Cafe;MALONGO Dosettes de café pur Arabica grande réserve;;3,67;3,85;3,83;3,87;3,91;3,85;;;;3,96;4,19;4,09;;
Epicerie sucrée;Cafe;MALONGO La Tierra café moulu pur arabica bio;7,37;;;;;;;;;;;;;;
Epicerie sucrée;Cafe;MAXWELL Café soluble qualité filtre;;;;;;;;;;;;;4,19;;
Epicerie sucrée;Cafe;MAXWELL HOUSE Café soluble qualité filtre;5,58;5,17;5,17;5,17;5,17;5,24;5,17;5,17;5,24;5,22;5,29;5,44;5,34;5,17;
Epicerie sucrée;Cafe;MAXWELL HOUSE Café soluble qualité filtre éco recharge;4,85;4,36;4,50;4,46;4,32;4,56;4,50;4,50;4,56;4,54;4,60;4,69;4,59;4,44;
Epicerie sucrée;Cafe;MELITTA Détartrant machines à café toutes marques liquide;;3,59;3,59;3,48;3,39;;;;;;3,71;3,99;;;
Epicerie sucrée;Cafe;MELITTA Filtre à café;2,04;1,83;1,83;1,78;1,78;1,91;1,86;1,88;1,91;1,90;1,88;2,04;1,93;1,85;
Epicerie sucrée;Cafe;MELITTA Filtres à café 1x4;;;;;;;3,92;;;;;;;;
Epicerie sucrée;Cafe;MEO Café bio en capsule compatible Nespresso;;;;;2,77;;;;;;;;;;
Epicerie sucrée;Cafe;MEO Café en grain espresso torréfaction à l'italienne;10,27;;;;;;9,52;9,35;;;;;;9,35;
Epicerie sucrée;Cafe;MEO Café en grains dégustation pur arabica;6,66;5,82;5,95;;;;;;;;;;;;
Epicerie sucrée;Cafe;MEO Café en grains excellence 100% arabica;;;;;;;;;;13,70;;;;;
Epicerie sucrée;Cafe;MEO Café en grains gastronomique pur arabica;6,66;5,82;5,95;;;;;;;;;;;;
Epicerie sucrée;Cafe;MEO Café moulu classique pur arabica;;3,16;3,29;3,25;3,31;;;;;;3,39;;3,45;;
Epicerie sucrée;Cafe;MEO Café moulu décaféiné pur arabica;6,50;5,85;5,85;;;;;;;;;;;;
Epicerie sucrée;Cafe;MEO Café moulu dégustation pur Arabica;5,97;5,24;5,45;;;;;;;;;;;;
Epicerie sucrée;Cafe;MEO Café moulu gastonomique pur Arabica;6,60;5,69;5,95;;;;;;;;;;;;
Epicerie sucrée;Cafe;MEO Café moulu pur arabica bio;6,25;5,34;5,84;5,54;5,69;5,65;5,72;5,65;5,69;5,69;5,84;6,09;5,95;5,54;
Epicerie sucrée;Cafe;MEO Café moulu pur arabica bio et équitable;;3,15;3,47;3,28;3,15;;3,40;3,35;;;3,47;3,49;3,39;3,28;
Epicerie sucrée;Cafe;MEO Café moulu riche et corsé;6,41;5,55;5,75;;;;;;;;;;;;
Epicerie sucrée;Cafe;MEO Capsules de café décaféiné bio intensité 6 compatibles Nespresso;3,12;;;;2,81;2,79;2,83;2,79;2,81;2,81;;;;2,73;
Epicerie sucrée;Cafe;MEO Dosettes de café arôme exquis riche et corsé compatibles Senseo;;3,20;3,39;;;;;;;;;;;;
Epicerie sucrée;Cafe;MEO Dosettes de café dégustation pur arabica compatible Senseo;3,99;3,39;3,59;;;;;;;;;;;;
Epicerie sucrée;Cafe;MEO Dosettes de café espresso torréfaction à l'italienne compatible Senseo;;3,59;3,79;;;;;;;;;;;;
Epicerie sucrée;Cafe;MEO Dosettes de café souples gastronomique compat. Senséo;3,99;3,39;3,59;;;;;;;;;;;;
Epicerie sucrée;Cafe;MEO Moka d'Ethiopie café moulu pur arabica;3,31;2,86;2,99;;;;;;;;;;;;
Epicerie sucrée;Cafe;MILKA Dosettes chocolat compatible Senséo;3,54;3,06;3,22;3,20;3,06;3,28;3,22;3,22;3,28;3,26;3,32;;3,26;3,16;
Epicerie sucrée;Cafe;NATURELA Café bio en grain pur Arabica;;3,08;;3,20;3,08;;;;;;3,39;3,57;3,47;;
Epicerie sucrée;Cafe;NATURELA Café en grains bio pur arabica intensité 7;13,78;11,62;12,78;12,09;5,83;12,34;12,51;10,62;12,43;11,25;12,78;12,68;12,44;12,09;
Epicerie sucrée;Cafe;NATURELA Café moulu bio 100% Arabica intensité 7;;;;;3,31;;;3,29;;3,31;;;;3,22;
Epicerie sucrée;Cafe;NATURELA Café moulu bio pur arabica intensité 7;;;;;;;;;12,42;;;;;;
Epicerie sucrée;Cafe;NESCAFE Café soluble Cappuccino à la noisette;;4,32;4,45;4,40;4,23;;;;;;4,58;4,85;4,75;;
Epicerie sucrée;Cafe;NESCAFE Café soluble cappuccino;4,07;3,66;3,75;3,71;3,59;3,81;3,81;3,75;3,81;3,79;3,85;3,99;3,95;3,69;
Epicerie sucrée;Cafe;NESCAFE Café soluble cappuccino vanille;4,29;3,85;3,95;3,91;3,97;4,01;4,01;3,95;4,01;3,99;4,05;4,19;4,19;3,89;
Epicerie sucrée;Cafe;NESCAFE Café soluble en stick cappuccino;;2,38;2,42;2,40;2,43;;2,45;2,42;2,45;2,44;2,48;2,58;2,52;2,38;
Epicerie sucrée;Cafe;NESCAFE Café soluble en sticks espresso intenso 100% arabica;;;;;;;;2,89;;;;;;;
Epicerie sucrée;Cafe;NESCAFE Café soluble sélection corsé et intense;5,53;5,07;5,11;5,07;4,47;5,18;5,11;5,11;5,18;5,16;5,24;5,41;5,35;5,07;
Epicerie sucrée;Cafe;NESCAFE Capsules de café Espresso intensité 5 compatibles Dolce Gusto;3,97;3,74;3,91;3,91;3,91;3,91;3,91;3,91;3,91;3,91;3,91;4,20;4,20;3,74;
