;;;02100 St Quentin Le Fayet;02300 Viry Noureuil;02500 Hirson;03410 Domerat;05000 Gap;06130 Grasse;06340 La Trinite;07500 Guilherand-granges;13400 Aubagne;13500 Martigues;13560 Senas;14123 Fleury Sur Orne;15000 Aurillac;16100 Chateaubernard;16400 La Couronne
;;;prix;prix;prix;prix;prix;prix;prix;prix;prix;prix;prix;prix;prix;prix;prix
categorie;type;nom;;;;;;;;;;;;;;;
Epicerie sucrée;Biscuits, gateaux;AFA Canistrelli aux amandes;;4,09;4,09;4,03;4,09;;;;;;4,06;;3,60;;
Epicerie sucrée;Biscuits, gateaux;ALLERGO Mini cakes marbrés sans gluten sans lactose sachets individuels;;3,87;3,87;3,76;3,57;;;;;;3,91;;4,07;;
Epicerie sucrée;Biscuits, gateaux;ARMOR DELICES La madeleine d'Armor pur beurre sachets individuels;;3,27;3,24;3,24;3,24;;;3,37;;3,29;;;;;
Epicerie sucrée;Biscuits, gateaux;AUCHAN Assortiment de biscuits fins au chocolat belge;4,18;3,87;3,87;3,79;3,87;3,94;3,94;4,02;3,94;3,94;3,79;3,98;3,94;3,79;
Epicerie sucrée;Biscuits, gateaux;AUCHAN Auchan gaufres mini liégeoises nature x9 -256g;;;;;1,53;;;;;;;;;;
Epicerie sucrée;Biscuits, gateaux;AUCHAN BIO Barquettes à la fraise sachets fraîcheur;;1,39;1,47;1,39;1,42;;1,45;1,47;1,45;1,42;1,39;;1,45;1,39;
Epicerie sucrée;Biscuits, gateaux;AUCHAN BIO Barres au chocolat fourrées au lait;;;1,99;1,99;1,99;;1,99;1,99;1,99;1,99;1,99;;;1,99;
Epicerie sucrée;Biscuits, gateaux;AUCHAN BIO Biscuits cuillers aux œufs frais, sachets fraîcheur;;;;2,00;2,04;;2,08;1,50;2,08;2,04;2,00;;;2,00;
Epicerie sucrée;Biscuits, gateaux;AUCHAN BIO Biscuits goûters fourrés au cacao, sachets fraîcheur;1,62;1,57;1,57;1,57;1,57;1,57;1,57;1,57;1,57;1,57;1,57;1,57;1,57;1,57;
Epicerie sucrée;Biscuits, gateaux;AUCHAN BIO Biscuits goûters fourrés au chocolat au lait, sachets fraîcheur;;1,97;2,09;1,97;2,01;;;2,09;;;1,97;;2,05;;
Epicerie sucrée;Biscuits, gateaux;AUCHAN BIO Biscuits lunettes de romans à la myrtille, sachets individuels;1,99;1,80;;1,80;1,84;1,84;1,87;1,91;1,87;1,84;1,80;;;1,80;
Epicerie sucrée;Biscuits, gateaux;AUCHAN BIO Biscuits nappés au chocolat au lait, sachets fraîcheur;2,16;1,96;2,08;1,96;2,00;2,00;2,04;2,08;2,04;2,00;1,96;2,06;2,04;1,96;
Epicerie sucrée;Biscuits, gateaux;AUCHAN BIO Biscuits nappés de chocolat noir, sachets fraîcheur;;1,99;2,11;1,99;2,03;;2,07;2,11;2,07;2,03;1,99;2,09;2,07;1,99;
Epicerie sucrée;Biscuits, gateaux;AUCHAN BIO Biscuits petit beurre avec tablette de chocolat noir;1,70;1,54;1,63;1,54;1,57;1,57;1,60;1,63;1,60;1,57;1,54;1,62;1,60;1,54;
Epicerie sucrée;Biscuits, gateaux;AUCHAN BIO Biscuits petit beurre riches en céréales, sachets fraîcheur;1,02;0,99;0,99;0,99;0,99;0,99;0,99;0,99;0,99;0,99;0,99;0,99;0,99;0,99;
Epicerie sucrée;Biscuits, gateaux;AUCHAN BIO Biscuits épeautre sésame, sachets fraîcheur;;0,99;0,99;0,99;0,99;;0,99;0,99;0,99;0,99;0,99;0,99;0,99;0,99;
Epicerie sucrée;Biscuits, gateaux;AUCHAN BIO Bâtonnets nappés de chocolat au lait;1,85;1,68;1,78;1,68;1,72;1,72;1,75;1,78;1,75;1,72;1,68;;1,75;1,68;
Epicerie sucrée;Biscuits, gateaux;AUCHAN BIO Cookies pépites de chocolat et quinoa;2,01;1,90;2,01;1,92;1,96;1,96;2,00;1,79;2,00;1,96;1,92;;;1,92;
Epicerie sucrée;Biscuits, gateaux;AUCHAN BIO Cookies tout chocolat;1,53;1,49;1,49;1,49;1,49;1,49;1,49;1,49;1,49;1,49;1,49;1,49;1,49;1,49;
Epicerie sucrée;Biscuits, gateaux;AUCHAN BIO Double galette de riz noisette et cacao;;0,99;0,99;0,99;0,99;;0,99;0,99;0,99;0,99;0,99;0,99;0,99;0,99;
Epicerie sucrée;Biscuits, gateaux;AUCHAN BIO Financiers pur beurre sachets individuels;;2,29;;2,29;2,34;2,29;2,38;2,43;2,38;2,34;2,29;;;2,29;
Epicerie sucrée;Biscuits, gateaux;AUCHAN BIO Fines galettes de riz complet;;0,91;0,91;0,91;0,91;;0,91;0,91;0,91;0,91;0,91;0,91;0,91;0,91;
Epicerie sucrée;Biscuits, gateaux;AUCHAN BIO Galette de riz au chocolat noir;1,02;0,99;0,99;0,99;0,99;0,99;0,99;0,99;0,99;0,99;0,99;0,99;0,99;0,99;
Epicerie sucrée;Biscuits, gateaux;AUCHAN BIO Galettes aux 4 céréales;;;;;0,99;;;;;;;;;;
Epicerie sucrée;Biscuits, gateaux;AUCHAN BIO Galettes de maïs;1,02;0,99;0,99;0,99;0,99;0,99;0,99;0,75;0,99;0,99;0,99;0,99;0,99;0,99;
Epicerie sucrée;Biscuits, gateaux;AUCHAN BIO Galettes de riz au chocolat au lait;1,02;0,99;0,99;0,99;0,99;0,99;0,99;0,99;0,99;0,99;0,99;0,99;0,99;0,99;
Epicerie sucrée;Biscuits, gateaux;AUCHAN BIO Galettes de riz complet au sésame;0,78;0,76;0,76;0,76;0,76;0,76;0,76;0,65;0,76;0,76;0,76;0,76;0,76;0,77;
Epicerie sucrée;Biscuits, gateaux;AUCHAN BIO Galettes pur beurre;0,91;0,88;0,88;0,88;0,88;0,88;0,88;0,88;0,88;0,88;0,88;0,88;0,88;0,90;
Epicerie sucrée;Biscuits, gateaux;AUCHAN BIO Madeleines nature, sachets individuels;2,04;;;1,85;1,89;1,85;1,92;1,96;1,92;1,89;1,85;;;1,86;
Epicerie sucrée;Biscuits, gateaux;AUCHAN BIO Mini cakes aux pépites de chocolat, sachets individuels;2,48;2,25;2,25;2,25;2,30;2,25;2,34;2,39;2,34;2,30;2,25;;2,34;2,25;
Epicerie sucrée;Biscuits, gateaux;AUCHAN BIO Mini cakes nature, sachets individuels;;1,75;;1,75;1,79;;;1,86;;;1,75;;;;
Epicerie sucrée;Biscuits, gateaux;AUCHAN BIO Moelleux au chocolat sachets individuels;;2,67;;2,67;2,72;;;2,83;;;2,67;;;;
Epicerie sucrée;Biscuits, gateaux;AUCHAN BIO Mon goûter biscuits fourrés chocolat au blé complet ss huile de palme;;1,93;2,05;1,93;1,97;;2,01;2,05;2,01;1,97;1,93;2,03;2,01;1,93;
Epicerie sucrée;Biscuits, gateaux;AUCHAN BIO Palets bretons pur beurre;1,37;1,24;1,31;1,24;1,26;1,26;1,29;1,31;1,29;1,26;1,25;;;1,25;
Epicerie sucrée;Biscuits, gateaux;AUCHAN BIO Palmiers biscuits feuilletés, sachets fraîcheur;1,11;1,08;1,08;1,08;1,08;1,08;1,08;1,08;1,08;1,08;1,08;1,08;1,08;1,08;
Epicerie sucrée;Biscuits, gateaux;AUCHAN BIO Petit beurre avec tablette de chocolat au lait;1,60;1,55;1,55;1,55;1,55;1,55;1,55;1,55;1,55;1,55;1,55;1,55;1,55;1,55;
Epicerie sucrée;Biscuits, gateaux;AUCHAN Barquettes à la fraise, sachets fraîcheur;0,77;0,71;0,71;0,70;0,71;0,73;0,73;0,74;0,73;0,73;0,70;0,74;0,73;0,70;
Epicerie sucrée;Biscuits, gateaux;AUCHAN Barre cookie biscuits au chocolat au lait sachets individuels;1,56;1,44;1,44;1,41;1,44;1,46;1,46;1,49;1,46;1,46;1,46;1,48;1,47;1,41;
Epicerie sucrée;Biscuits, gateaux;AUCHAN Barre moelleuse aux pépites de chocolat;2,21;2,05;2,01;2,01;2,05;2,09;2,09;2,13;2,09;2,09;2,01;;;2,01;
Epicerie sucrée;Biscuits, gateaux;AUCHAN Barre moelleuse marbrée;2,15;1,99;1,95;1,95;1,99;2,03;2,03;2,07;2,03;2,03;1,95;;2,03;1,95;
Epicerie sucrée;Biscuits, gateaux;AUCHAN Barres fondantes biscuits sablés fourrés au chocolat au lait, sachets indiv;;2,37;2,37;2,33;2,37;;;;;;2,42;;;;
Epicerie sucrée;Biscuits, gateaux;AUCHAN Barres fourrées biscuits au chocolat et lait sans huile de palme sachets individuels;;1,07;1,07;1,05;1,07;1,09;1,09;1,11;1,09;1,09;1,09;;1,09;1,05;
Epicerie sucrée;Biscuits, gateaux;AUCHAN Biscuits Speculoos tradition, sachets fraîcheur;1,64;1,52;1,52;1,49;1,52;1,55;1,55;1,58;1,55;1,55;1,49;1,56;1,55;1,49;
Epicerie sucrée;Biscuits, gateaux;AUCHAN Biscuits cuillers dégustation aux œufs frais, sachets fraîcheur;;1,86;1,86;1,86;1,86;;;1,93;;1,89;1,82;1,91;1,89;1,82;
Epicerie sucrée;Biscuits, gateaux;AUCHAN Biscuits cuillers spécial dessert aux œufs frais, sachets fraîcheur;2,48;2,30;2,30;2,30;2,30;2,34;2,34;2,39;2,34;2,34;2,25;2,36;2,34;2,25;
Epicerie sucrée;Biscuits, gateaux;AUCHAN Biscuits feuilletés palmiers nature;1,09;;;;;1,03;1,03;1,03;1,03;1,03;;;;0,99;
Epicerie sucrée;Biscuits, gateaux;AUCHAN Biscuits fourrés ronds saveur chocolat;;3,47;3,47;3,40;3,40;;;;;;3,54;;;;
Epicerie sucrée;Biscuits, gateaux;AUCHAN Biscuits moelleux fourrés au chocolat sachets individuels;1,45;1,35;1,32;1,32;1,35;1,37;1,37;1,40;1,37;1,37;1,32;1,39;1,37;1,32;
Epicerie sucrée;Biscuits, gateaux;AUCHAN Biscuits nappés au chocolat noir sans gluten sachets fraîcheur;;;;;2,83;;;2,88;;;;;2,87;;
Epicerie sucrée;Biscuits, gateaux;AUCHAN Biscuits palets bretons sachets fraîcheurs;0,70;0,65;0,65;0,64;0,65;0,67;0,67;0,68;0,67;0,67;0,68;0,67;0,67;0,68;
Epicerie sucrée;Biscuits, gateaux;AUCHAN Biscuits petit beurre aux pépites de chocolat;1,29;1,19;1,19;1,17;1,19;1,22;1,22;1,24;1,22;1,22;1,17;1,23;1,22;1,17;
Epicerie sucrée;Biscuits, gateaux;AUCHAN Biscuits petit beurre riches en blé;0,81;0,75;0,75;0,74;0,75;0,77;0,77;0,78;0,77;0,77;0,74;0,78;0,77;0,74;
Epicerie sucrée;Biscuits, gateaux;AUCHAN Biscuits petit beurre, sachets fraîcheur;;1,38;1,38;1,35;1,38;;;1,43;;1,40;1,35;1,42;1,40;1,35;
Epicerie sucrée;Biscuits, gateaux;AUCHAN Biscuits sablés fourrés aux figues sans huile de palme;;1,01;1,01;0,99;1,01;;;;;;0,96;1,04;1,03;;
Epicerie sucrée;Biscuits, gateaux;AUCHAN Biscuits sablés nappés de chocolat au lait, sachets fraîcheur;1,06;0,98;0,98;0,96;0,98;1,00;1,00;1,02;1,00;1,00;1,00;1,01;1,00;0,96;
Epicerie sucrée;Biscuits, gateaux;AUCHAN Biscuits sablés nappés de chocolat noir, sachets fraîcheur;;1,02;1,02;1,00;1,02;;;;;;1,04;1,05;1,04;;
Epicerie sucrée;Biscuits, gateaux;AUCHAN Boudoirs aux œufs frais, sachets fraîcheur;1,05;0,97;0,97;0,97;0,97;0,99;0,99;1,01;0,99;0,99;0,95;1,00;0,99;0,95;
Epicerie sucrée;Biscuits, gateaux;AUCHAN Briochettes nature;;;;;2,03;;;;;;;;;;
Epicerie sucrée;Biscuits, gateaux;AUCHAN Brownie au chocolat et aux noisettes;;1,96;1,92;1,92;1,96;2,00;;2,04;;2,00;1,92;2,02;2,00;1,92;
Epicerie sucrée;Biscuits, gateaux;AUCHAN Broyé du Poitou galettes pur beurre;3,14;;;;2,91;2,96;;3,02;2,96;2,96;;;;;
Epicerie sucrée;Biscuits, gateaux;AUCHAN Bâtonnets enrobés de chocolat au lait sans gluten;;;;;;;;;;;;;2,70;;
Epicerie sucrée;Biscuits, gateaux;AUCHAN Bâtonnets gourmands biscuits tout chocolat;1,19;1,10;1,10;1,05;1,10;;1,12;1,14;1,12;1,12;1,12;;;1,05;
Epicerie sucrée;Biscuits, gateaux;AUCHAN Bâtonnets nappés de chocolat au lait;0,77;0,71;0,71;0,70;0,71;0,73;0,73;0,74;0,73;0,73;0,73;0,74;0,73;0,70;
Epicerie sucrée;Biscuits, gateaux;AUCHAN Bâtonnets nappés de chocolat blanc;1,19;1,10;1,10;1,12;1,10;1,12;1,12;1,14;1,12;1,12;1,12;1,13;1,12;1,12;
Epicerie sucrée;Biscuits, gateaux;AUCHAN Cake aux fruits sans huile de palme prétranché;1,64;1,52;1,49;1,49;1,52;1,55;1,55;1,58;1,55;1,55;1,49;1,56;1,55;1,49;
Epicerie sucrée;Biscuits, gateaux;AUCHAN Chinois Brioche à la crème pâtissière;2,27;;;2,06;2,10;;2,14;2,14;2,10;2,14;;;;2,10;
Epicerie sucrée;Biscuits, gateaux;AUCHAN Choco twizz bâtonnets nappés de chocolat au lait;1,09;1,01;1,01;0,99;1,01;1,03;1,03;1,05;1,03;1,03;1,03;1,04;1,03;0,99;
Epicerie sucrée;Biscuits, gateaux;AUCHAN Chocogusto gâteaux génoise sachets individuels;1,31;1,21;1,19;1,19;1,21;1,24;1,24;1,26;1,24;1,24;1,19;1,25;1,24;1,19;
Epicerie sucrée;Biscuits, gateaux;AUCHAN Cigarettes gourmandes, sachets fraîcheur;1,01;0,94;0,94;0,92;0,94;0,96;0,96;0,98;0,96;0,96;0,92;0,97;0,96;0,92;
Epicerie sucrée;Biscuits, gateaux;AUCHAN Cookies aux pépites de chocolat et aux noix;1,13;1,04;1,04;1,02;1,04;1,06;1,06;1,09;1,06;1,06;1,06;1,07;1,06;1,02;
Epicerie sucrée;Biscuits, gateaux;AUCHAN Cookies aux pépites de chocolat et nougatine;0,80;0,74;0,74;0,73;0,74;0,76;0,76;0,77;0,76;0,76;0,76;0,77;0,76;0,73;
Epicerie sucrée;Biscuits, gateaux;AUCHAN Cookies aux pépites de chocolat saveur noix de coco, sachets fraîcheur;;;;;0,98;1,00;;1,02;;;;;;;
Epicerie sucrée;Biscuits, gateaux;AUCHAN Cookies tout chocolat;0,80;0,74;0,74;0,73;0,74;0,76;0,76;0,77;0,76;0,76;0,76;0,77;0,76;0,73;
Epicerie sucrée;Biscuits, gateaux;AUCHAN Crac choco biscuits nappés de chocolat au lait sans huile de palme;;1,09;1,09;1,07;1,09;1,11;;1,13;;1,11;1,11;1,12;1,11;1,07;
Epicerie sucrée;Biscuits, gateaux;AUCHAN Cream loop biscuits fourrés;0,80;0,74;0,74;0,73;0,74;0,76;0,76;0,77;0,76;0,76;0,76;0,77;0,76;0,73;
Epicerie sucrée;Biscuits, gateaux;AUCHAN Cream loop biscuits fourrés enrobés de chocolat blanc sachets fraîcheur;2,05;1,99;1,99;1,99;1,99;1,99;1,99;1,99;1,99;1,99;1,99;1,99;1,99;1,99;
Epicerie sucrée;Biscuits, gateaux;AUCHAN ESSENTIEL Goûters fourrés ronds au chocolat;;0,54;0,54;0,54;0,54;;;0,54;;;0,54;0,60;0,55;;
Epicerie sucrée;Biscuits, gateaux;AUCHAN ESSENTIEL Goûters fourrés ronds au chocolat, lot de 3;1,65;1,72;1,72;1,72;1,72;1,72;1,72;1,72;1,72;1,72;1,72;1,72;1,72;1,72;
Epicerie sucrée;Biscuits, gateaux;AUCHAN ESSENTIEL Madeleines longues;;0,66;0,66;0,66;0,66;0,66;0,66;0,66;0,66;0,66;0,66;;;0,66;
Epicerie sucrée;Biscuits, gateaux;AUCHAN ESSENTIEL Tartelettes à la fraise;;0,49;0,49;0,49;0,49;;;0,49;;0,49;0,49;0,49;0,49;0,49;
Epicerie sucrée;Biscuits, gateaux;AUCHAN GOURMET Assortiment de biscuits au chocolat;;2,13;2,13;2,09;2,13;;;2,22;;;2,09;;2,17;;
Epicerie sucrée;Biscuits, gateaux;AUCHAN GOURMET Biscuits croquantines pur beurre aux amandes et chocolat au lait;;1,52;1,52;1,49;1,52;;;;;;1,49;;1,55;;
Epicerie sucrée;Biscuits, gateaux;AUCHAN GOURMET Biscuits crèpes dentelle fines et croustillantes pur beurre;;1,32;1,32;1,29;1,32;;;1,37;;1,34;1,29;1,35;1,34;1,29;
Epicerie sucrée;Biscuits, gateaux;AUCHAN GOURMET Biscuits triangles croustillants à la noisette sur lit de chocolat au lait;;;;;1,70;;;;;;;;;;
Epicerie sucrée;Biscuits, gateaux;AUCHAN GOURMET Cigarettes gourmandes au chocolat;;1,72;1,72;1,69;1,72;;;1,79;;1,76;1,69;;;1,69;
Epicerie sucrée;Biscuits, gateaux;AUCHAN GOURMET Florentins aux amandes effilées;;;;;1,58;;;1,64;;;;;;;
Epicerie sucrée;Biscuits, gateaux;AUCHAN GOURMET Madeleines pur beurre au sel de Guérande sachets individuels;;;;;2,86;;;;;;;;;;
Epicerie sucrée;Biscuits, gateaux;AUCHAN Galettes Bretonnes pur beurre aux pépites de chocolat;;0,92;0,92;0,90;0,92;;0,94;0,95;;0,94;0,96;;;0,97;
Epicerie sucrée;Biscuits, gateaux;AUCHAN Galettes bretonnes pur beurre;0,64;0,59;0,59;0,58;0,59;0,60;0,60;0,61;0,60;0,60;0,60;0,61;0,60;0,60;
Epicerie sucrée;Biscuits, gateaux;AUCHAN Galettes suédoise aux flocons d'avoine et chocolat;;1,95;1,95;1,91;1,95;;;2,02;;1,99;1,91;2,00;1,99;1,91;
Epicerie sucrée;Biscuits, gateaux;AUCHAN Gateau tout chocolat;;1,74;1,71;1,71;1,74;;1,78;1,81;1,78;1,78;1,71;;;1,71;
Epicerie sucrée;Biscuits, gateaux;AUCHAN Gaufres fourrées à la vergeoise;;;;;0,98;;;;;;;;;;
Epicerie sucrée;Biscuits, gateaux;AUCHAN Gaufres liégeoises aux perles de sucre sachets individuels;;1,30;;;;;;;;;;;;;
Epicerie sucrée;Biscuits, gateaux;AUCHAN Gaufres liégeoises nappées au chocolat belge sachets individuels;;2,08;;2,04;;;;;;;2,04;;;;
Epicerie sucrée;Biscuits, gateaux;AUCHAN Gaufres poudrées;;1,20;1,18;;;;;;;;1,18;;;;
Epicerie sucrée;Biscuits, gateaux;AUCHAN Gaufres poudrées pocket;;;;;;;;;;;1,30;;;;
Epicerie sucrée;Biscuits, gateaux;AUCHAN Gaufrettes fourrées enrobées de chocolat;0,98;0,91;0,91;0,89;0,91;0,93;0,93;0,94;0,93;0,93;0,89;0,93;0,93;0,89;
Epicerie sucrée;Biscuits, gateaux;AUCHAN Gaufrettes fourrées praliné noisette;;0,80;0,80;0,78;0,80;;;0,83;;0,81;0,78;0,82;0,81;0,78;
Epicerie sucrée;Biscuits, gateaux;AUCHAN Goûter donuts nappés chocolat;1,50;1,39;1,36;1,36;1,39;1,41;1,41;1,44;1,41;1,41;1,36;;1,41;1,36;
Epicerie sucrée;Biscuits, gateaux;AUCHAN Goûters fondants fourrés au chocolat;1,29;1,19;1,19;1,18;1,19;1,22;1,22;1,24;1,22;1,22;1,22;1,23;1,22;1,18;
Epicerie sucrée;Biscuits, gateaux;AUCHAN Goûters fondants fourrés à la noisette;1,33;1,23;1,23;1,21;1,23;1,26;1,26;1,28;1,26;1,26;1,26;1,27;1,26;1,21;
Epicerie sucrée;Biscuits, gateaux;AUCHAN Gâteau marbré goût chocolat;1,67;1,54;1,51;1,51;1,54;1,57;;1,60;;1,57;1,51;1,59;1,57;1,51;
Epicerie sucrée;Biscuits, gateaux;AUCHAN Génoise lait et cacao, sachets individuels;2,13;2,07;2,07;2,07;2,07;2,07;;2,07;;2,07;2,07;2,07;2,07;2,07;
Epicerie sucrée;Biscuits, gateaux;AUCHAN Génoise lait et coco, sachets individuels;2,13;;;;2,07;2,07;2,07;;2,07;2,07;;;;2,07;
Epicerie sucrée;Biscuits, gateaux;AUCHAN Génoise napées de chocolat de noir saveur fraise;;;;;0,97;;;;;;;;;;
Epicerie sucrée;Biscuits, gateaux;AUCHAN Génoises nappées de chocolat blanc saveur cerise;0,98;0,91;0,91;0,91;0,91;0,93;0,93;0,94;0,93;0,93;0,92;0,93;0,93;0,92;
Epicerie sucrée;Biscuits, gateaux;AUCHAN Génoises nappées de chocolat noir saveur framboise;0,98;0,91;0,91;0,91;0,91;0,93;0,93;0,94;0,93;0,93;0,89;0,93;0,93;0,89;
Epicerie sucrée;Biscuits, gateaux;AUCHAN Génoises nappées de chocolat noir saveur orange;0,98;0,91;0,91;0,91;0,91;0,93;0,93;0,94;0,93;0,93;0,89;0,93;0,92;0,89;
Epicerie sucrée;Biscuits, gateaux;AUCHAN Langues de chat dégustation, sachets fraîcheur;1,01;0,93;0,93;0,91;0,93;0,95;0,95;0,97;0,95;0,95;0,91;0,96;0,95;0,91;
Epicerie sucrée;Biscuits, gateaux;AUCHAN MIEUX VIVRE Biscuits choco crunchy sans gluten;;2,65;;2,65;2,70;;;;;;2,70;;2,76;;
Epicerie sucrée;Biscuits, gateaux;AUCHAN MIEUX VIVRE Biscuits gaufrettes au cacao sans gluten;;2,49;2,49;2,49;2,54;;;;;;2,54;;2,59;;
Epicerie sucrée;Biscuits, gateaux;AUCHAN MIEUX VIVRE Biscuits rochers coco sans gluten sachets individuels;1,87;1,70;1,70;1,70;1,73;1,70;1,77;1,77;1,77;1,77;1,73;;1,77;1,70;
Epicerie sucrée;Biscuits, gateaux;AUCHAN MIEUX VIVRE Biscuits sablés nappés chocolat au lait sans gluten;;2,52;2,52;2,52;2,57;;;2,62;;2,62;2,57;;2,62;;
Epicerie sucrée;Biscuits, gateaux;AUCHAN MIEUX VIVRE Brownies sans gluten;3,08;2,99;2,99;2,99;2,99;2,99;2,99;2,99;2,99;2,99;2,99;;2,99;2,99;
Epicerie sucrée;Biscuits, gateaux;AUCHAN MIEUX VIVRE Cookies aux 3 chocolats pur beurre sans gluten;;;;;3,21;;;;;;;;;;
Epicerie sucrée;Biscuits, gateaux;AUCHAN MIEUX VIVRE Cookies éclats de chocolat sans gluten;2,65;2,40;2,40;2,40;2,45;2,40;2,50;2,50;2,50;2,50;;;;2,40;
Epicerie sucrée;Biscuits, gateaux;AUCHAN MIEUX VIVRE Coquilles moelleuses sans gluten;2,61;2,36;2,36;2,36;2,41;2,36;2,45;2,45;2,45;2,45;2,41;;2,45;2,36;
Epicerie sucrée;Biscuits, gateaux;AUCHAN MIEUX VIVRE Goûter fourrés cacao sans gluten pochon;;2,55;2,55;2,55;2,60;;;2,65;;2,65;2,60;;;;
Epicerie sucrée;Biscuits, gateaux;AUCHAN MIEUX VIVRE Mini cakes fourrés goût chocolat sans gluten;;2,95;2,95;2,95;2,95;;;;;;2,95;;2,95;;
Epicerie sucrée;Biscuits, gateaux;AUCHAN MMM! Cookies chocolat blanc saveur canberries;;1,45;1,45;1,42;1,45;;;;;;1,48;;1,48;;
Epicerie sucrée;Biscuits, gateaux;AUCHAN MMM! Cookies cœur fondant chocolat noisette;1,57;1,45;1,45;1,42;1,45;1,48;1,48;1,51;1,48;1,48;1,48;1,49;1,48;1,42;
Epicerie sucrée;Biscuits, gateaux;AUCHAN Madeleines coquilles aux pépites de chocolat, sachets individuels;2,08;2,02;2,02;2,02;2,02;2,02;2,02;2,02;2,02;2,02;2,02;;;2,02;
Epicerie sucrée;Biscuits, gateaux;AUCHAN Madeleines coquilles aux œufs frais, sachets individuels;2,42;2,24;2,20;2,20;2,24;2,29;2,29;2,33;2,29;2,29;2,20;2,31;2,29;2,20;
Epicerie sucrée;Biscuits, gateaux;AUCHAN Madeleines coquilles marbrées au chocolat sachets individuels;;1,80;1,76;1,76;1,80;1,83;;1,87;;1,83;1,76;;1,83;1,76;
Epicerie sucrée;Biscuits, gateaux;AUCHAN Madeleines longues aux œufs frais;2,49;2,31;2,26;2,26;2,31;2,35;2,35;2,40;2,35;2,35;2,26;;2,35;2,26;
Epicerie sucrée;Biscuits, gateaux;AUCHAN Madeleines longues aux œufs frais, sachets fraîcheur;;1,37;1,34;1,34;1,37;;;1,42;;1,39;1,34;1,41;1,39;1,34;
Epicerie sucrée;Biscuits, gateaux;AUCHAN Madeleines longues cœur saveur chocolat, sachets fraîcheur;1,82;1,68;1,65;1,65;1,68;1,72;1,72;1,75;1,72;1,72;1,65;1,73;1,72;1,65;
Epicerie sucrée;Biscuits, gateaux;AUCHAN Madeleines nappées au chocolat, sachets individuels;;2,74;2,69;2,69;2,74;;;2,85;;2,80;2,69;;;2,69;
Epicerie sucrée;Biscuits, gateaux;AUCHAN Madeleines étoiles pur beurre sachets individuels;;1,51;1,48;1,48;1,51;;;1,57;;1,54;;;;1,48;
Epicerie sucrée;Biscuits, gateaux;AUCHAN Madeleinettes coquilles aux œufs frais;;1,10;1,10;1,10;1,10;;;1,10;;;1,10;;;;
Epicerie sucrée;Biscuits, gateaux;AUCHAN Maxi cookies aux pépites de chocolat;1,32;1,22;1,22;1,20;1,22;1,25;1,25;1,27;1,25;1,25;1,25;1,26;1,25;1,20;
Epicerie sucrée;Biscuits, gateaux;AUCHAN Mini brownies aux noisettes, sachets individuels;1,90;1,75;1,72;1,72;1,75;1,79;1,79;1,82;1,79;1,79;1,72;1,81;1,79;1,72;
Epicerie sucrée;Biscuits, gateaux;AUCHAN Mini brownies aux pépites de chocolat, sachets individuels;1,78;1,65;1,62;1,62;1,65;1,68;1,68;1,72;1,68;1,68;1,62;1,70;1,68;1,62;
Epicerie sucrée;Biscuits, gateaux;AUCHAN Mini cakes aux fruits, sachets individuels;2,24;2,09;2,05;2,05;2,09;2,13;2,13;2,17;2,13;2,13;2,05;;2,13;2,05;
Epicerie sucrée;Biscuits, gateaux;AUCHAN Mini goûters biscuits fourrés au chocolat sachets fraîcheur;;0,97;0,97;0,95;0,97;;;;;;0,99;1,00;0,99;;
Epicerie sucrée;Biscuits, gateaux;AUCHAN Mini rochers à la noix de coco;1,05;1,02;1,02;1,02;1,02;1,02;1,02;1,02;1,02;1,02;1,02;;;0,67;
Epicerie sucrée;Biscuits, gateaux;AUCHAN Mini ronds tartelettes chocolat et lait, sachets fraîcheur;1,21;1,12;1,12;1,09;1,12;1,14;1,14;1,16;1,14;1,14;1,14;1,14;1,13;1,09;
Epicerie sucrée;Biscuits, gateaux;AUCHAN Mini roulés fraise, sachets individuels;1,43;1,33;1,30;1,30;1,33;1,35;1,35;1,38;1,35;1,35;1,30;1,37;1,35;1,30;
Epicerie sucrée;Biscuits, gateaux;AUCHAN Mini roulés goût chocolat, sachets individuels;1,43;1,33;1,30;1,30;1,33;1,35;1,35;1,38;1,35;1,32;1,30;1,37;1,35;1,30;
Epicerie sucrée;Biscuits, gateaux;AUCHAN Mon Goûter Carré Biscuits fourrés saveur chocolat;1,02;0,95;0,95;0,93;0,95;0,96;0,96;0,98;0,96;0,96;0,96;0,98;0,97;0,93;
Epicerie sucrée;Biscuits, gateaux;AUCHAN Mon gouter Biscuits fourrés au chocolat;1,85;1,71;1,71;1,68;1,71;1,74;1,74;1,78;1,74;1,74;1,74;1,76;1,75;1,68;
Epicerie sucrée;Biscuits, gateaux;AUCHAN Mon gouter biscuits tout chocolat;1,00;0,93;0,93;0,91;0,93;;;0,96;0,95;0,95;0,95;0,95;0,95;0,91;
Epicerie sucrée;Biscuits, gateaux;AUCHAN Mon goûter Biscuits fourrés à la pâte à tartiner noisettes;1,88;1,74;1,74;1,71;1,74;1,78;1,78;1,81;1,78;1,78;1,78;1,80;1,78;1,71;
Epicerie sucrée;Biscuits, gateaux;AUCHAN Mon goûter biscuits fourrés goût vanille au blé complet;;;;;0,91;;;0,95;;;;;;;
Epicerie sucrée;Biscuits, gateaux;AUCHAN Mon goûter croustillant biscuits fourrés à la pâte à tartiner noisettes;1,10;1,02;1,02;1,00;1,02;1,04;1,04;1,06;1,04;1,04;1,00;1,05;1,04;1,00;
Epicerie sucrée;Biscuits, gateaux;AUCHAN Muffins aux pépites de chocolat, sachets individuels;2,08;1,93;1,89;1,89;1,93;1,97;1,97;2,00;1,97;1,97;1,89;;;1,89;
Epicerie sucrée;Biscuits, gateaux;AUCHAN Pain d'épices fondant au miel;1,82;1,68;1,65;1,65;;1,72;1,72;1,75;1,72;1,72;1,65;1,73;1,72;1,65;
Epicerie sucrée;Biscuits, gateaux;AUCHAN Palmiers biscuits feuilletés nappés au chocolat au lait, sachets fraîcheur;1,14;1,05;1,05;1,03;1,05;1,07;1,07;1,10;1,07;1,07;1,03;1,08;1,07;1,03;
Epicerie sucrée;Biscuits, gateaux;AUCHAN Palmiers nature biscuits feuilletés sachets fraîcheur;0,57;0,52;0,52;0,51;0,52;0,53;0,53;0,54;0,53;0,53;0,51;0,54;0,53;0,51;
Epicerie sucrée;Biscuits, gateaux;AUCHAN Petits beurre avec tablette de chocolat au lait, sachets fraîcheur;1,48;1,38;1,38;1,35;1,38;1,40;1,40;1,43;1,40;1,40;1,40;1,42;1,40;1,35;
Epicerie sucrée;Biscuits, gateaux;AUCHAN Petits beurre avec tablette de chocolat blanc, sachets fraîcheur;1,24;1,14;1,14;1,12;1,14;1,16;1,16;1,19;1,16;1,16;1,16;1,18;1,16;1,12;
Epicerie sucrée;Biscuits, gateaux;AUCHAN Petits beurre avec tablette de chocolat noir, sachets fraîcheur;1,10;1,02;1,02;1,00;1,02;1,04;1,04;1,06;1,04;1,04;1,04;1,05;1,04;1,00;
Epicerie sucrée;Biscuits, gateaux;AUCHAN Petits beurre avec tablette de chocolat saveur noisettes, sachets fraîcheur;;1,17;1,17;1,14;1,17;;;1,21;;1,19;1,19;1,20;1,19;1,14;
Epicerie sucrée;Biscuits, gateaux;AUCHAN Petits beurre avec tablette fourée au lait;;1,42;1,42;1,39;1,42;;;;;;1,45;1,46;1,45;;
Epicerie sucrée;Biscuits, gateaux;AUCHAN Quatre-quarts pur beurre;3,87;3,58;3,51;3,51;3,58;3,65;3,65;3,72;3,65;3,65;3,51;;3,65;3,51;
Epicerie sucrée;Biscuits, gateaux;AUCHAN RIK & ROK Barquettes chocolat-noisettes, sachets fraîcheur;0,76;0,70;0,70;0,69;0,70;0,72;0,72;0,73;0,72;0,72;0,69;0,72;0,72;0,69;
Epicerie sucrée;Biscuits, gateaux;AUCHAN RIK & ROK Biscuits sablés nappés de chocolat au lait, sachets fraîcheur;0,87;0,80;0,80;0,79;0,80;0,82;0,82;0,83;0,82;0,82;0,82;0,83;0,82;0,79;
Epicerie sucrée;Biscuits, gateaux;AUCHAN RIK & ROK Croc' ton pote minis goûters fourrés parfum chocolat, sachets fraîcheur;1,02;0,99;0,99;0,99;0,99;0,99;0,99;0,99;0,99;0,99;0,99;0,99;0,99;0,99;
Epicerie sucrée;Biscuits, gateaux;AUCHAN RIK & ROK Crêpes fourrées au chocolat sans huile de palme, sachets individuels;;;1,55;;;;;;;;;;;;
Epicerie sucrée;Biscuits, gateaux;AUCHAN RIK & ROK Mini cakes aux pépites de chocolat, sachets individuels;1,32;1,22;1,20;1,20;1,22;1,25;1,25;1,27;1,25;1,25;1,20;1,26;1,25;1,20;
Epicerie sucrée;Biscuits, gateaux;AUCHAN RIK & ROK Mini cakes fourrés abricot sans huile de palme, sachets individuels;1,32;;;;;1,25;1,25;1,27;;1,25;;;;;
Epicerie sucrée;Biscuits, gateaux;AUCHAN RIK & ROK Mini cakes fourrés chocolat et pépites, sachets individuels;1,32;1,22;1,20;1,20;1,22;1,25;1,25;1,27;1,25;1,25;1,20;;1,25;1,20;
Epicerie sucrée;Biscuits, gateaux;AUCHAN RIK & ROK Mini cakes fourrés fraise, sachets individuels;1,32;1,22;1,20;1,20;1,22;1,25;1,25;1,27;1,25;1,25;1,20;;1,25;1,20;
Epicerie sucrée;Biscuits, gateaux;AUCHAN RIK & ROK Mini cakes marbrés chocolat, sachets individuels;1,32;1,22;1,20;1,20;1,22;1,25;1,25;1,27;1,25;1,25;1,20;;1,25;1,20;
Epicerie sucrée;Biscuits, gateaux;AUCHAN Sablé fourrés cacao noisettes;;1,22;1,22;1,20;1,22;;;1,27;;1,25;1,20;1,26;1,25;1,20;
Epicerie sucrée;Biscuits, gateaux;AUCHAN Sablés nappés chocolat au lait sachets fraicheur;;;;;2,78;;;;;;;;;;
Epicerie sucrée;Biscuits, gateaux;AUCHAN Sprits biscuits au chocolat au lait;0,96;0,89;0,89;0,87;0,89;0,90;0,90;0,92;0,90;0,90;0,87;0,91;0,90;0,87;
Epicerie sucrée;Biscuits, gateaux;AUCHAN Sprits, biscuits sablés au beurre;1,64;1,52;1,52;1,49;1,52;1,55;1,55;1,58;1,55;1,55;1,49;1,56;1,55;1,49;
Epicerie sucrée;Biscuits, gateaux;AUCHAN Tartelettes framboise sans gluten;;;;;2,45;;;;;;;;2,50;;
Epicerie sucrée;Biscuits, gateaux;AUCHAN Tartelettes nappées chocolat noisette, sachets fraîcheur;;1,05;1,05;1,03;1,05;;1,07;1,09;;1,07;1,03;1,08;1,07;1,03;
Epicerie sucrée;Biscuits, gateaux;AUCHAN Tartelettes nappées de chocolat;1,07;0,99;0,99;0,97;0,99;1,01;1,01;1,03;1,01;1,01;0,97;1,02;1,01;0,97;
Epicerie sucrée;Biscuits, gateaux;AUCHAN Tartelettes nappées saveur fraise;1,07;0,99;0,99;0,97;0,99;1,01;1,01;1,03;1,01;1,01;0,97;1,02;1,01;0,97;
